"quote","attribution"
"Adam war ein Mensch - das erklärt alles. Er wollte den Apfel nicht des Apfels wegen, sondern nur, weil er verboten war.","Mark Twain, The Tragedy of Pudd'nhead Wilson, chapter 2"
"Denn ich begleitete dich als Knab' im Garten; wir gingen unter den Bäumen umher, und du nanntest und zeigtest mir jeden. Dreizehn Bäume mit Birnen und zehn voll rötlicher Äpfel schenktest du mir und vierzig Feigenbäume.","Homer, Odyssee, 24. Gesang"
"Der Äpfelchen begehrt Ihr sehr, // Und schon vom Paradiese her. // Von Freuden fühl ich mich bewegt, // Dass auch mein Garten solche trägt.","Johann Wolfgang von Goethe, Faust I, Vers 4132 ff. / Die Schöne"
"Der Sündenfall – Weißt du den Grund, warum in den Apfel gebissen hat Adam? / Um der Theologie einen Gefallen zu tun.","Ludwig Feuerbach, Gedanken über Tod und Unsterblichkeit, Xenien (63)"
"Einst hatt ich einen schönen Traum; // Da sah ich einen Apfelbaum. // Zwei schöne Äpfel glänzten dran, // Sie reizten mich, ich stieg hinan.","Johann Wolfgang von Goethe, Faust I, Vers 4128 ff. / Faust"
"Über Rosen lässt sich dichten, // In die Äpfel muss man beißen.","Johann Wolfgang von Goethe, Faust II, Vers 5168 f. / Gärtner"
"Viel Obst ist ungesund, wir kauen alle dran, // Was eines Apfels Kost für Leid uns angetan.","Friedrich von Logau, Sinngedichte"
"Ein verdorbener Apfel im Korb verdirbt das ganze gute Obst.","Aus den Niederlanden"
"Wie ein Apfelbaum unter den Bäumen des Waldes, so ist mein Liebster unter allen andren Männern! In seinem Schatten möchte ich ausruhn und seine Früchte genießen.","Hohelied Salomos, 2,3"
