"quote","attribution"
"Alle Leute haben eine Nähmaschine, ein Radio, einen Eisschrank und ein Telefon. Was machen wir nun? fragte der Fabrikbesitzer. // Bomben, sagte der Erfinder. // Krieg, sagte der General. // Wenn es nicht anders geht, sagte der Fabrikbesitzer.","Wolfgang Borchert, „Lesebuchgeschichten“, in: „Draußen vor der Tür“, ISBN 3-499-10170-X, 1956, S. 81"
"Bombardiert zu werden ist eine außerordentlich passive Angelegenheit. Es gibt nichts, was man tun kann – außer vielleicht zu den Bomben zu sprechen. Man hat als Überlebender auch nichts, worauf man stolz sein könnte.","- Kurt Vonnegut, welt.de...in einem Gespräch mit Volker Hage"
"Man darf nicht die Demokratie zum Vorwand nehmen und ein Land angreifen. Die Menschenrechte kann man den Menschen gewiss nicht durch Bomben bringen. Es darf auch nicht sein, daß man den Kampf gegen eine Diktatur zum Vorwand nimmt, um die Ressourcen einer Nation zu rauben. Demokratie und Menschenrechte können nur mit dem und durch den Willen der Menschen verwirklicht werden, nicht dagegen.","Shirin Ebadi, fünfte Weltethos-Rede, »Der Beitrag des Islam zu einem Weltethos«, 20. Oktober 2005, Tübingen, weltethos.org"
"Polen hat nun heute nacht zum erstenmal auf unserem eigenen Territorium auch durch reguläre Soldaten geschossen. Seit 5 Uhr 45 wird jetzt zurückgeschossen! Und von jetzt ab wird Bombe mit Bombe vergolten! Wer mit Gift kämpft, wird mit Giftgas bekämpft!","Adolf Hitler, Rede vor dem deutschen Reichstag, 1. September 1939, Verkündigung des Angriffs auf Polen und Beginn des Zweiten Weltkriegs, reichstagsprotokolle.de"
"Unsere Leidenskraft ist ebenso groß wie eure Macht, uns Leiden zuzufügen. Tut mit uns, was ihr wollt, wir werden euch trotzdem lieben. […] Werft uns ins Gefängnis, wir werden euch trotzdem lieben. Werft Bomben in unsere Häuser, bedroht unsere Kinder, wir werden euch trotzdem lieben.","Martin Luther King, Die Kraft zum Lieben. Konstanz, 1964. Übersetzer: Hans-Georg Noack"
"War einst ein Anarchisterich, // der hatt den Attentatterich // Er schmiß mit Bomben um sich rum; // es knallte nur so: bum bum bum. // Einst kam der Anarchisterich // an einen Schloßhof fürstelich, // und unterm Rock verborgen fein // trug er ein Bombombombelein.","Erich Mühsam, Der Anarchisterich"
