"quote","attribution"
"Sich im Respekt zu erhalten // Muss man recht borstig sein. // Alles jagt man mit Falken, // Nur nicht das wilde Schwein.","Johann Wolfgang von Goethe, West-östlicher Divan - Buch der Sprüche"
"Der Falke fliegt aufgrund seines Gefieders und nicht aufgrund seines Fleisches.","Aus Kroatien"
"Eulen hecken keine Falken.","Aus Deutschland"
"Man erkennt den Falken am Flug.","Aus Russland"
"Mancher entfleucht dem Falken und wird vom Sperber gehalten.","Aus Deutschland"
"So eins nicht Falken hat, muss es mit Eulen beizen.","Aus Deutschland"
